{"appearance":{"accent":"blue","chromeMaterial":"system","colorScheme":"system","cursorBlink":true,"cursorStyle":"block","customAccentRGB":31487,"monospacedFontName":"JetBrains Mono","terminalFontSize":14,"terminalThemeID":"default"},"hosts":[{"address":"server.example","authenticationHint":"none","id":"AAAAAAAA-BBBB-CCCC-DDDD-EEEEEEEEEEEE","launchMode":"autoTmux","name":"production","osHint":"linux","port":22,"portForwards":[],"sortOrder":0,"tags":[],"transport":"ssh","user":"alice"}],"identities":[],"jumpChains":[],"knownHosts":[],"settings":{"accessoryBarKeys":["escape"],"bellNotificationEnabled":false,"bellSoundEnabled":true,"bellVisualEnabled":true,"filesDefaultDestination":"cwd","filesReaperDays":7,"modifierBehavior":"oneShot","scrollbackLines":10000},"version":2}
